{
  "schema_version": "000b1-frozen-methodology-v1",
  "contract_version": "000b1-contract-v1",
  "canonical_wispral_base": "6b5696a6becc360948282712cc9339df9cb3a67c",
  "speaker_design": {
    "total_human_speakers": 20,
    "speaker_disjoint_splits": true,
    "speakers_by_split": {"development": 4, "qualification": 4, "test": 12},
    "utterances_per_speaker": {"developer_entity": 24, "general_collateral": 12},
    "planned_total_utterances": 720,
    "planned_test_utterances": {"developer_entity": 288, "general_collateral": 144, "total": 432},
    "max_primary_utterance_seconds": 12,
    "minimum_test_microphone_environment_profiles": 4,
    "cadence_requirement": "Test panel must contain deliberate slow, conversational, and fast-but-intelligible delivery assignments distributed across speakers; assignment is frozen before recording.",
    "identity_minimization": "Use pseudonymous speaker ids. Do not require sensitive demographic attributes for benchmark eligibility or publish identifying metadata.",
    "rationale": "Twelve held-out test speakers provide speaker-disjoint replication rather than a single-voice benchmark; 24 developer-entity utterances per test speaker yields 288 primary developer utterances while keeping recording burden bounded. Four development and four qualification speakers permit methodology/harness work without touching test speakers. The design is descriptive benchmark evidence, not a population-level inferential claim."
  },
  "preprocessing": {
    "tool": "FFmpeg",
    "version": "9.0.1",
    "source_repository": "FFmpeg/FFmpeg",
    "source_tag": "n9.0.1",
    "tag_object": "501bb49457b9dfb25d6a208832e0a6e6cd53108d",
    "source_commit": "bf1b838f2ab88b4f8fd83443325c782ea0e0f7fa",
    "tag_signature_verified_upstream": true,
    "attempt_binary_sha256_required": true,
    "attempt_version_output_sha256_required": true,
    "canonical_format": "RAW_PCM_S16LE",
    "sample_rate_hz": 16000,
    "channels": 1,
    "sample_format": "PCM_S16LE",
    "denoising": "NONE",
    "loudness_normalization": "NONE",
    "semantic_silence_trim": "NONE",
    "command_template": "ffmpeg -nostdin -hide_banner -loglevel error -i INPUT -map_metadata -1 -vn -sn -dn -ac 1 -ar 16000 -c:a pcm_s16le -f s16le OUTPUT.s16le",
    "canonical_output_sha256_required": true,
    "float32_adapter_rule": "Interpret each little-endian signed int16 sample and convert to float32 as sample / 32768.0 with no clipping, gain, denoising, or candidate-specific preprocessing.",
    "feed_chunk_ms": 500,
    "feed_chunk_samples": 8000,
    "finalization_zero_pad_ms": 660,
    "finalization_zero_pad_samples": 10560,
    "timing_markers": ["speech_audio_start", "speech_audio_end", "feed_end_after_zero_pad"]
  },
  "common_c0": {
    "language": "en",
    "device": "CPU_ONLY",
    "repository_context": "OFF",
    "test_specific_context": "OFF",
    "post_decode_entity_correction": "OFF",
    "external_language_model": "OFF",
    "candidate_specific_audio_transform": "OFF",
    "feed_chunk_ms": 500,
    "finalization_zero_pad_ms": 660
  },
  "c0_by_family": {
    "moonshine": {
      "runtime_revision": "234f60faa0eb388b01cdf7e60aca232af37aefda",
      "integration": "Pinned Moonshine Transcriber streaming API; feed canonical float32 samples in 500 ms chunks and finalize after universal zero pad.",
      "threads": "RUNTIME_DEFAULT_NO_DOCUMENTED_STT_THREAD_OPTION",
      "ort_providers": "UNSET_CPU_DEFAULT",
      "max_tokens_per_second": 6.5,
      "use_speculative_decoding": true,
      "keyterms": "OFF",
      "context": "OFF",
      "keyterm_boost": 2.0,
      "context_max_terms": 200,
      "transcription_interval_seconds": 0.5,
      "vad_threshold": 0.0,
      "vad_window_duration_seconds": 0.5,
      "vad_hop_size_samples": 512,
      "vad_look_behind_sample_count": 8192,
      "vad_max_segment_duration_seconds": 15,
      "word_timestamps": false,
      "decode_incomplete_lines": true,
      "identify_speakers": false,
      "return_audio_data": true,
      "spelling_model": "OFF",
      "search": "PINNED_RUNTIME_STREAMING_DECODER_DEFAULT",
      "temperature": "NOT_EXPOSED_AS_STT_OPTION_AT_PINNED_API",
      "punctuation": "MODEL_NATIVE_NO_POSTPROCESSING",
      "timestamps": "WORD_TIMESTAMPS_OFF",
      "previous_text_carryover": "PINNED_RUNTIME_STREAMING_STATE_ONLY_NO_REPOSITORY_PROMPT",
      "endpointing": "VAD_THRESHOLD_0_AND_EXPLICIT_INPUT_END",
      "max_primary_utterance_seconds": 12
    },
    "whisper.cpp": {
      "runtime_revision": "371b5a7561823ab2bb32142d2751e35e7534727b",
      "integration": "Research adapter reproduces pinned examples/stream non-VAD fixed-step decode semantics over canonical samples; no microphone capture dependency in evidence harness.",
      "threads": 4,
      "step_ms": 500,
      "length_ms": 5000,
      "keep_ms": 200,
      "max_tokens": 0,
      "audio_ctx": 0,
      "beam_size": -1,
      "sampling": "GREEDY",
      "temperature_fallback": "OFF",
      "no_fallback": true,
      "language": "en",
      "translate": false,
      "keep_context": false,
      "initial_prompt": "OFF",
      "prompt_carryover": "OFF",
      "vad": "OFF_BY_NONZERO_STEP",
      "vad_threshold": "NOT_USED",
      "timestamps": "OFF_BY_NON_VAD_STREAM_PATH",
      "single_segment": true,
      "use_gpu": false,
      "flash_attention": false,
      "punctuation": "MODEL_NATIVE_NO_POSTPROCESSING",
      "streaming_semantics_expected_from_docs": "DOCUMENTED_NOT_OBSERVED_CHUNKED_REDECODE"
    },
    "sherpa-onnx": {
      "runtime_revision": "917bed95c8e5c7c18aa4d69fea42e9ef8ef0a60e",
      "integration": "OnlineRecognizer.from_transducer; feed canonical float32 samples in 500 ms chunks, decode while ready, feed universal zero pad, call input_finished, then drain ready states.",
      "threads": 4,
      "provider": "cpu",
      "sample_rate_hz": 16000,
      "feature_dim": 80,
      "decoding_method": "greedy_search",
      "max_active_paths": 4,
      "lm": "OFF",
      "lm_scale": 0.1,
      "lodr_fst": "OFF",
      "lodr_scale": -0.1,
      "hotwords_file": "OFF",
      "hotwords_score": 1.5,
      "modeling_unit": "OFF",
      "bpe_vocab": "OFF",
      "blank_penalty": 0.0,
      "endpoint_detection": "OFF_PRESEGMENTED_INPUT_FINISHED",
      "punctuation": "MODEL_NATIVE_NO_POSTPROCESSING",
      "timestamps": "PRESERVE_RAW_RESULT_WHERE_EXPOSED_NO_SCORING_DEPENDENCE"
    }
  },
  "fairness_notes": [
    "CPU-only is frozen for the founding C0 comparison; controlled performance evidence remains separately gated.",
    "Thread count is four where the pinned public API exposes it. Moonshine does not document an STT thread-count option in the pinned options surface, so this asymmetry is explicit and prevents general CPU-efficiency claims from uncontrolled C0 evidence.",
    "The 660 ms zero tail is a universal feed finalization suffix delivered to every candidate after the speech_audio_end marker; it is not part of the human reference transcript and is identical across candidates.",
    "No backend-native prompt, keyterm, hotword, repository vocabulary, external LM, or post-decode entity correction is permitted in C0."
  ]
}
